english,romanized
i paid attention.,nga ge attention gin ye tay
i have absolute confidence in your judgement.,nga gi choe lu raechae bom yoe
the epidemic has been contained.,ani epodemic dhi contained en daben
he is checking his cellphone.,kho julthrun ta dey
who baked this cake?,ani cake dhi gagi zoyi
appearances are deceiving.,dong ghi shob chabi
how did you get caught?,gadey bay caught joyi
carry the bags upstairs.,bags ya ba sa
nobody could explain how the thing was made.,gagi ya explain bay mitsub bay ani chala di gadey bay zoyi gga
i lost my wallet on the way to school.,nga lobdra na jowi lamkha nguelkhu janyii
he took his book.,kho ra gi book bayi
ugyen has been in the hospital for three weeks.,ugyen hospital na dhuenthra chi ya so yi
i study mathematics.,nga tsi ta bi
i stood under a tree to avoid getting wet.,nga sing wolu dheyi gola lem majoni den lu
chime quite often sleeps more than eight hours.,chime maam ra hours wa maam neu mey
i gathered from this letter that he was angry.,kho ley thop thop en kho tsip za doeo da
i would take it as a sign.,nga ani tag tshen dhi ba gay
you have been busy.,busy mae sa choe dari cap chi dhe
we have been friends.,nga chay charo bay dayi
pema is a bit older than mary.,pema the mary lay atsi bom
is bigamy a crime in australia?,bigamy dhi australia na la layshom men ya
i want you to sit with me.,choe nga chi kha dhey
the room has two windows.,khangmi lu gochu nye yoe
you are a talented kid.,choe cho drup chen du
i do not even know what to say to that.,nga dhi gachi lab na ya meshay bay
we will not change anything.,nga chey gi gani ya change bay mitsub
can you shut up?,khatsum bey dey na
are you willing to make a deal?,cheo goen ja zo ne dhang day ena
that is what i expected it to be like.,dhi zum wong zey rabnoyi ba
i told mary i wanted a divorce.,nga kha jelni say mary lu lap chi
i hope you enjoy the show.,choe show dhi tro wa thoen thoen wong nyo wi reywa yoe
i take a bath almost every day.,nga atara zum chhu bi
i think we have wasted enough of our time.,nga ghi choe ghi time enough waste bayi
is this cage shark-proof?,ani cage dhe shark-proof enna
i memorized the poem.,nga gi poem memorise bay yi
i hope this does not ruin our friendship.,i hope nga chey gi ngye gi friendship meb mitam wong sey ani kor lae
ugyen has some nosy neighbors.,chim tshang khay chab me chi du
the bible has it written like this.,bible na day bay dri dhi dhu
look at the setting sun.,sun set lu ta wai
i think tashi is still breathing.,tashi dhi bung tang dhae
light the candles.,candle tsu light bay
you are a nerd.,choe di atara book nam doe go mi chi em bay sa
you remind me of someone i used to know.,choe na mi chi cheri tang chu may
if only i had a pretty dress like that!,nga lu ja chhi chhi chi yoe ba chin!
many leaders supported the compromise.,me bom tshu gi jabjor bew in thuendrel lu
this lawn mower runs on gasoline.,ani lawn mower gasoline na la beu mey
i advise you to change clothes.,gola so di goen pi lab ja
even his servants despised him.,kho ghi jaro tshu ghi ya kho mi ga bay
let us talk to ugyen about that.,ugyen nam lo lab ta gay tayy ani korlay de.
i have more than enough.,nga lu lang bay yoe
we have got enough.,ngachey lam chi yoe
"if it had not been for his help, i would have failed.","kho gi charo ma bay wa chin, nga fail theen soop yong"
i doubt that.,mashay mai
what do you like about him?,gachi gayi kho gi korlay
i paid for the drinks.,nga gi teyi teru chang gi den lu
chime even likes cold pizza.,chime gi cold pizza ya gawong tay
i belong here.,nga na
you do not sound too sure.,de layshom chi enna
his behavior spoke volumes about his upbringing.,kho gi bezha gi kho ra gi kolay gara ten dey
i never touched gyeltshen.,gyeltshen tro ra ma tro may
"ugyen was pacing in his room, unable to calm himself down.","ugyen room na pha tsu jo, kho ra clam ra bay ma tsu"
he lives by himself.,kho kho ra doe ne yoe
we are all going to die anyway.,nga chey gara tsa chi shi wong
we have three days left.,ngachey lu nyim sum luedi yoe
she became scared when she noticed the man following her.,mo dro nu bhus gi kho tingdaw may say shab da
i do not read this kind of book much.,nga dey zum mei lhadep lha ney mi
get out!,thoen song chi kha!
hawaii is a popular tourist resort.,hawaii di popular tourist resort chi en
i thought it was a secret.,sangwai tam enn sey no deyi tey
how was the math test?,tshi gi choenju gadey bey deyi
i have no one else to turn to.,nga ga lu ya turn bay mistubay
we need a bit more time to prepare.,nga chay detshay atshi ho bay prepare bayni ghi doen lay
give me a little time to think it over.,"atsi gu may, nok sam tang gay"
who was that who answered your phone?,ga may ani choe call thu mi di?
he quit.,kho gi bay ma tsub bay
we drive everywhere.,nga vhey gaty ya gari dha jowi
she went to germany to study medicine.,mo germany lu sowa gi paycha tawa yasi
dorji admitted he did not do what we had asked him to do.,dorji ghi ngachay ghi lab me la mabay sey admit baeyi
be calm.,calm bay doe may
i am able to run.,nga gi ju tshub
i have not had dinner.,nge chi ru ge tho ma za
i am about to tell you something important.,nga choe lu lo important chi lab gey
he was intrigued.,kho intrigued
are you seeing anybody right now?,choe datoh ga chi kha mo
we must hurry.,joba beygay
i gather you were hurt.,nga shey chi choe hurt joyi sey
what're you all doing in the library?,choeng gara library na gachi bew
the master praised the slave.,lopen gi lopthru lu ney rang yoep bay lab nu
we hate violence.,nga chey tsu thabzing bay ni mi ga
i dance in my living room all the time.,living room na zhab thra cham wong
i need some nutmeg.,nga kha tsha thang thang chi go bay
that is my business.,nge la en
these keys are not mine.,ani dhi mi tshu nga ghi men.
who is ready for more?,ga ready yoe
i know i heard something.,nga shey nga chi goye
this computer does not work.,ani computer di la mi bae way
they are part of us.,khong dhee ngachay gee mee ra en
how was your birthday?,choe ge kaywi nyim gaday bay doeye
drop it!,zha ma!
we are both insane.,ngachey nye cha ra choe lo enn
that is the way.,anay bay ra en
space travel is no longer a dream.,zamling chekha jone gi nyelam men maray da ben
do not do this.,ani zum ma bay
where are the meters?,meters dhu gaty dhu
i want to get there early so we can get good seats.,joba joo bay sago layshoom na day go bay ngachey tshu
please say the alphabet in reverse.,abc ulta na labsh
i am looking forward to christmas.,nga christmas lu ghu day dhi
now let us get down to work.,yaa daban garaa lok la na jo gay
your eyes are very beautiful.,choe gi mito jawae
he got ready for departure.,kho joni dra de ya so nu
that is the last thing i remember.,ani di last thing may tay nga remeber bay baew gi
no one arrived.,ga ya ma wong
what a bummer!,awwoo wai
technology solved many of the problems.,technology gey kangyel mam ra selew en
the conference ended two hours ago.,tsogdu di chutsey gi hema tsa yee
they are all normal.,khong layshom du
the hail cracked the window.,sew gi godi gara chak tang nu
there is one thing that is bothering me.,nga chi gi bother bay zhap may
he is a creationist.,kho creationist enn
graham greene is a favorite author of mine.,graham greene dhi nge gi tsom pa po ga sho chi enn
keep looking.,ta bay ra day
not all of them are present.,la lo chi mindu
i leave for paris tomorrow.,nga naba paris jodho
i do not like this jacket.,nga ani jacket mi ga wae
i cut classes.,joni mi class na
who is the photographer?,photographer ga mo
some fish are able to change their gender.,fish la lu gender change bay tub
is there a student discount?,student discount yoe ga?
i will go along with your plan.,choe lab mi zum baygay
my mom walked into my room.,ngi ayi room na wongyi si
i suppose i felt a little jealous.,mapa atsi chi mitotsha yi
i can hardly walk.,nga lham ra jomi tsu bay
speak slowly and clearly.,lo golay dang hing sa sa bay lab
is it already open?,haema lay ra go chi dhi yoe ya
his aim is to become a doctor.,kho drungtsho bay ni cha zhi may
"ugyen is a good friend of yours, is not he?","ugyen di choe gi charo cham sho en maena, engush"
chime showed mary something.,chime gi mary lu chala chi tin nu
i see a queen.,nga gi azhi thong yee
you should free those animals from the cage.,aphi sem chen tshu cage lay tang go bay
i did not take it. you can check my pockets.,nga ghi maba. nge ghi hemchu ta
pema seemed distracted.,pema sem yeng sonu
we cannot just sit around and do nothing.,nga chey tsu deybeyra dey bey gani ya mabey ba mitub
call us.,nga chey lu call bay
it was nowhere to be seen.,gatay ya thong sa mindu ani di
the house caught fire.,house fire jo nu
come in.,nang na sho
"i suggest we eat just a little now, and then go out later.",dato atsi za bay tama chikha jogay mena
we are going back to boston.,ngachey boston na lok jo dho
it was really close.,halam chi bay
how about going to see a movie with me?,jo gay nga nam picture tawa
never in my life have i heard or seen such a thing.,"nge life na ha yang mago, thong ya mathong"
i promised him to keep it secret.,nga kho lu promise bayi ani di sangwa bay zha ni sey
nowadays children do not play outdoors.,dari nabai alu tshu chikha tshem tshey be ya mindhu
i support the proposal.,nga...ani dray cha dhi lu ngye leen yoe
i may be wrong.,wrong wong
the whistle of the steam train woke us at daybreak.,ani stream train gi wistle gi nga chay woke at daybreak
is there something in particular that you want to hear?,choe lo chi particular bay nen go noyi ya
i caught him cheating on the exam.,nga gi kho trem chabsa thongyee
there is plenty of light.,afa bheen yoe pe tsha dhu
i would like to pay in cash.,cash bay jin go me noi
i do not know when i will be back.,nga nam lok wong ga mi shey bey
have you read this book yet?,choe ghi ani keydhep dhi lhab tshai yi ga
he has just as many books as his father does.,kho lu ya kidheb apa lu yoe dho zum ra dhu
"actually, that is why i am here.",ani bay ne dhi ghi nga na wong ye tay
people like to talk.,mi tsu lo lap ni lu gasu chi embay
why did you decide to speak about that now?,ani di gi korlay daben gachi bay lab mo
we need supplies.,nga byertsang go bae
i was upstairs.,nga tho kha daye
chime's crying. i know.,chime ngu dey. nga shey
i did not know you were staying at this hotel.,nga gi mashey chie ani za khang na doe bi tsay
i have everything.,nga lu ga chira yoe
i liked this film.,nga ani lok nyen ga.
i will never work for you.,nga choe ngyam nam ya la mibay
i know how hard it is to do that.,ani bay ni dhi hard yoe sey nga ghi shey
come on.,jo gay
i like being with you.,nga choe dha chikha gaway
it goes both ways.,ani lam ja dram na may
shall i close the window?,gochu dham ga
he will explain it to you when he comes back.,kho gi lab wong tama lok wom dha
the plane crashed.,namdu boto re nu
this house is abandoned.,ani chim dhi ko zha zhab enn
the difference between the right word and almost the right word is the difference between lightning and the lightning bug.,lo ngoma dha lo almost ngoma ghi bana kheypar dhi lightning dha lightning bug ghi kheypar embey
it is what i am.,its what i am
do you mind if i turn down the tv?,tv seyb da khey mi ga?
no comment.,comment me
he made it clear that he had nothing to do with the matter.,"kho gi hayma lay ra kab day, kho dhu na bay goop gachi ya me say."
i want to make something clear.,chi toen tey zo gey
everything was going great.,kho lu neytang dro c c chi jung nu
i neither smoke nor drink.,nga thamkhu da chang thung ni mi
is the procedure clear?,ha goi ga procedure tshu
i would be delighted if that happened again.,daru an zum lok bay jung ba chin nga sem gani may
he should have bought some pencils.,kho pencil ngo gop dayi
ugyen wants to come with us.,ugyen nga chi nam jo gay lo
"if you are to succeed, you must work hard.",cho gay go ba chin cho la tsha gyen bay go
perhaps he knows this story.,yanchin kho ge ahne story shay do wong
they are christians.,khong tshu christians embay
what is wrong with you people?,ga chi baew dha mo ani mi tshu
my nose is stuffed up.,ngi hap sub nu
our teacher is a real idiot.,nga chae ghi lopen dhi no sam ra tang mae shae bae
show me another example.,daru atsi ten....thuen ni baydho
please put your cigarette out.,choe ghi tam khu dhi zhadha dato
something has happened to my car.,nga ghi gari gachi chi baynu
when did you first meet him?,choe gi kho first na gaty chayi
i finally got a job.,dhaben nga la chi thob chi
the students divided themselves into three groups.,lobthu tsu datsen sum na gobsha chab nu
i did not pay attention to him.,nga kho lu damn majin
he cleaned it up.,kho gi chayi
do you think it is just a coincidence?,coincidence cham chi en may mayna
ugyen does not have what it takes to be the boss.,ugyen ghi gopen bey thsub pai cho drup mindhu.
none of this makes any sense.,khung ga ney ya mindu ani tsu
i am not sure i want the job.,nga ten ten mi nga ani job go ga mingo ga
how old were you when you moved to boston?,choe boston na jow dha lu lo gamchi dheyi
i know about that.,nga gi shey
volunteers are cleaning up the park today.,kheylangpa tsu dari lingpa chha dhey
let me do it my way.,nga ra ghi way na try baygay.
his father has never scolded him.,apa gi kho tso tha ra ma tang
my parents do not understand me.,nge pham gey nge ko lay me shay way
he could not hold back his tears.,kho kho rai michu ka matsu bay
i should be in charge.,nge responsibility in ty
dorji told mary that she should not go there alone.,dorji gi mary li lab nu mo pha mo ra cham chi ma jo say
he came from another country.,kho tshegyalkhap lay wongm em bay
i am pema's neighbor.,nga pema ghi chim tshang enn
i want to see him very much.,nga kho namey samey ta go noii
you will find out soon enough.,choe gi jo ba ra shey yong
i wrote it for gyeltshen.,nga ghi gyeltshen ghi den lu dri driw en
join us.,ngachey ngyam join bay
today is wednesday.,dari wednesday ean
my hobby is collecting old coins.,nga hobby dhi coin nyem collect beni en
thinley was the one who took this picture.,par tab mi thinley enn
the golden gate bridge is made of iron.,golden gate bridge di iron gi zo zow en mena
do you want to get drunk?,razi go noyi ga?
i do not want to talk to you about this.,nga choe lu ani ko ley lap go mano
he broke his arm playing soccer.,laap cha nu football tshay bay
i need subtitles.,nga lu jurtshing chi goo bay
this is true love.,ani dhi ngoma gi gawa enn
who has a better idea?,cha zhi layshom ga lu yoeb mo
"when does your sister come back from work? i do not know, but i think she will arrive at home a few minutes before me.","choe num la lay nam wong?mashay ,nga tawda mo karma ngye su chigi nge hema wong"
the value of a good education cannot be measured in terms of money.,good education gi value di tiru gi measure bay mitsub
who can tell what will happen in the future?,ga gi lap shay mawong pa na gachi bay wong ga
all the boys are the same age.,bhus gara lo dren drey en
there is no rush.,ma tshap
they all knew.,shay khong tshu ghi
the vote is unanimous.,tshogen gi ga gi ya mishay
i feel like smiling.,nga ga go noh may
this is his.,ani dhi kho ghi eng
my wife had a baby last week.,nga gi aum tsu gi alu kew chi enn
it is none of my business!,ani nga ge la men
i am sure that he is happy.,nga gi shay kho sem gadi yoea say
i want you to be with me.,choe nga da ra zha go bay
thinley says he wants a puppy for christmas.,ugyen ghe aup jesus ghe kewi nym ba rochi go ne lo
i thought it would be fun.,nga gi no yi ani trowa yoep wong say
gyeltshen looks very sick.,gyeltshen dhi nanaw zoom thommay
he is one of my neighbours.,kho nge chim tsang en
i myself will repair that machine.,nga gi chokha chab wong truel diii
dorji became anorexic when he was a high school student.,"kho high school student bay dowb da lu, he was anorexic"
i contacted my parents.,nga apa aie lu labchi
i have not seen him for about three years.,nga ghi kho ma thong ba loo sum ya si
he easily licked his opponent.,kho ra ghi opponnect lick bay nu si
americans have to spend hours figuring out their taxes.,chilip tsu gantha gantha gowo may tax tapni den lu
we are pulling back.,jab shi chap dho nga chay
i want to have fun.,nga trowa toen go noyi
i run a small business.,business chungku chi run bay dho
i am from brazil.,nga brazil ley enn
he can compress the most words into the smallest ideas of any man i ever met.,kho me gaa ghi tshig gachi ya idea chungku chi na zo tshub.
we will have to do this quickly.,nga chey ani joba bay go
our army attacked the enemy during the night.,nga chay magmi tsu gi jamchay tsu thaywa luck nu
gyeltshen is at the door. please ask him in.,gyeltshen gokha yoe. kholu dri dha
i am wet.,nga loem bayi
i want to personally thank you.,nga choe lu kadrin sam go bey
you are very angry.,choe nammay sammay tshib zha nu
it looks like you have lost ten pounds.,choe ten poinds jang nu mena.
they all have come.,khong gara yong nu
i always counted you as a friend.,nga gi choe hema lae ra charo bae tsi ye
that could be a coincidence.,dhi coincidence wong ty
they looked relieved.,kong shaynu
i will pay the bill.,tiru nga gi tra yong.
i hope you are not alone.,choe ra cham men wong noyi rey wa yoe
what does there is a tide imply?,idk bro
thousands of people were deceived by the advertisement.,ani advertisement gi dhi mi halam lu shob chap nu
you are twisting my words.,choe lo gara ju taam may ty
it is good enough.,am chi ghi tub bay
we regret his death.,sem mi sem si yi
dorji liked that.,ani ben dorji gi ga nu may
get out!,chi kha thoen ya song!
i could not get a definite answer from him.,kho ley len tenten chi thob matsub
have you ever been betrayed by a friend?,choe charo gi gukur bay yi ga
i will go along with you as far as the station.,station tsen nga choe nam jo gey
he explained the facts at length.,kho ghe len ngoma bay rem bay lab dhay
what do you call your mother?,aye lu gachi lap mo
you should not have done that. it was wrong.,"choe ani bay ni miwong baty, choe bay mi di wrong en"
they never found out the truth.,khong gi denpa di mathob bay
you cannot blame her for not knowing what she has not been taught.,"choe mo lu blame mabay, mo lu ani toen ra ma toen ba gadey bay shey ni"
i am doing all i can.,nga bey tsu mi bey do
i like movies.,nga movie taa ni gaa
it is kind of boring.,dhi om ngyel wi zhi may
he goes fishing every other day.,kho atara nya zung ba jowmay
he congratulated me on my success.,kho gi nga lu tashi delek yoe lo
i have got a lot of good ideas.,nga lu naykab halam yoe
"i feel better today, but i am not well enough to work.",nga a tshai dra bay san la dhi bay me tshub ni em bay
i saw the game.,game thong yi nga gi
everything's ready.,gara dadri yasi
i will not fail this time.,this time dhi nga fail me then
ugyen introduced mary to his family.,ugyen gi mary kho gi family na introduce baynu
i was still eating when the doorbell rang.,nga toh za dhay yi san go dung dhay
i like to be with my classmates.,classmate nam dhaygo bay
she tried on a new dress.,mo gola sap try bay nu
paper burns quickly.,shoku joba mae tsik jow mae
keep it.,zha da
he is in pain.,kho zu chab dey
i do not want there to be any misunderstanding.,mga chat tsu gi nar ma misunderstandings ming go may
i do not like being told what to do.,"rho gi la bay lab da, nga bay go me ngo bay"
"you can accelerate as much as you want, but since the car's in neutral, we will not be going anywhere.","choe accelerate gadem chi chap ru chap, choe gi gari neutral na bayni dhigi, ngachi gatay ya jo mitsup"
go jump in the lake.,tsho na chong
she advised him to fasten his seat belt.,mo gi seat belt dam zey lab dhey kho lu
all children do not like apples.,alu gara apple miga
what does it cost to build a new house in this neighborhood?,chim sap chap dha teru gam chi jo wong
he is just kidding you.,kho gedra baywu mea
we cannot let this continue.,countine bay me tshub
i cannot imagine what it must've been like.,nga nos tang me tshubay gazum wong ga
he is the father of three children.,kho alo sum gi apa en
i am ashamed to ask you such a silly question.,choe lu question dreni ghi yang zaw mae
it may not be a good idea to eat while you are running.,ju dap dha ju ne de layshom chi men
we are winners.,nga chey tshu gaymi enn
that is a myth.,ani dhi myth en
it is characteristic of him to behave like that.,kho gi bayzha men
you do not have to do what gyeltshen says.,gyeltshen gi ga lab choe bay mingo
she is a gifted artist.,mo dhi zhabthra zomi dragsho chi een
that is why i worry about you.,di bya ni di gi chow ta nga droww mya
i wonder which of you will win.,ga dhe gay wong ga mo
that is open to debate.,debate bay nee ra enn ani thou kha.
who can run fastest in your class?,lhobkhang ley shu ju tshub mi dhi ra ga mo?
she looks sad.,mo sem maga nu
i am sure thinley would not like it.,nga gi shay thinlay gi mi ga sae
i walked across the park.,nga lingka dhi na nam jo bay deyyi
"if you push this button, the door will open.","choe ani ni gu aoeb ba chin, gho chi wong"
you sort of hinted that you wanted me to ask you out.,choe gi nga lu men zu tab chi ra bay ni dhe gi en
i heard shots being fired.,shots fire josa ha goi
i hurried so i would not miss the train.,nga joba wongyie train miss jowong no dhi
i do not like the way he speaks to me.,kho lo lab lab maga
who does this suitcase belong to?,ani suitcase ga lu belong baewong
i lost.,jang yi nga
"i would like to stay and chat, but i have got a meeting to go to.",zhen dhee nga loo lab dhoe nee en day baw da nga zhenzom na jo go bay
we have no reason to change our plans.,nga lu doen da gani ya mi plan change bay ni gi
it is human nature.,mi gi rangzhin mey ty
did you buy this book?,ani paychha dhi choe gi nyoi ya
i am glad you brought that up.,choe ghi bang dhi dra chi
i felt a light touch on my shoulder.,nge chey to gu touch light chi feel beyi
what is all that about?,di gachi korlay ena?
how long does it take to go to the office from your home?,gamchi time take bew mae choe chim ley office tshen
the army has advanced to the river.,army tsu chu tsa wa hoe nu
i am not going to disappear.,nga yel mijo
i will just leave.,khimi nga jo da gay
let us hurry up.,joba bay c.
"i have not read his novel, and my brother has not either.",nga ghi ani sung di malhab nga ghi achi ghi ya malhab
i gave up hope.,nga hope ra zosi
your death will not have been in vain.,choe shi mi di thro lo ma joe bay bay wong
do you understand or not?,ha goi yan ma go??
i have two nephews.,nga lu tsa wo ni woe
i am very much in favor of this.,nga charo gobay
he drank a shot of whiskey.,kho gi whiskey shot tang giye mae
where can we get lunch?,nima ghi toh gatey lay thob ga
i will come right now.,nga wongni
he has a bicycle.,kho luu bicycle yoe
what a phony!,ah shobzey di!
i am sure you are going to enjoy it.,nga gi shay choe ngo ma ra enjoy baywo say
they are not going to give you this job.,khong tsu gi ani job di mi jin choe lu
i think we found it.,"nga ta wa chin, thob chi may"
i do not know what to say to pema.,nga meshey pema lu gachi lab na
someone must have taken my umbrella by mistake.,ga ena chi ghi nge umbrella mistakenky banu
when is school over?,lob da lay nam tang wong
i tried.,nga bay tayi
i see.,nga thom mae
you are all i have got.,choe lay lhab gaya me nga lu
we need to call someone.,nga chay call chap go mi chi na.
what were the meetings like?,meeting na ga chi lap day
i have something to trade.,nga lu tshong drel bay ni chala chi yoe
he speaks english with a strong german accent.,kho strong german accent na english speak bae wong
you two should be ashamed of yourselves.,choe choera nyi lu tadhi dhi ngo tshagob du maray
"because her parents got divorced, the girl had hardly any contact with her father.",mo gi pham kha jayw lay pham dha dray wa maam mendhu
he spent a lot of money this weekend.,kho this weekend teru deadly layi
do you eat a lot?,choe do cc cc zayi ya
she forgot to feed the dog.,mo gi jay nu rochi na tho jini
he is something of a celebrity.,kho famous zum en
is anybody there?,ga yoe ga mo pha?
she left the last page blank.,mo gi last page satong zhanu
what would you do if you had one year free?,one year free yoebachin gachi baywong
i am a little skeptical.,nga dhi asti dokpa yoe
this may just come in handy someday.,phen tho ni may nyim chi
i want you to say you are not going back to boston.,choe boston mijo lab
he came to school even though he was unwell.,kho naru ya school na wong yi
do not talk about me.,nge korlay loo malab jdha.
i will monitor your progress from my computer.,nga monitor bay gay may nga rang gi computer nalay
they have to be very careful.,khong tsu na thay bay go
i want to make you smile.,nga choe ghi gha zum toen chu ni
we hope you enjoyed your stay.,choe na day bay sem ga wi no wi ray wa yoe
speaking english is very difficult for me.,english lapni dhi nge dhen lu lha kha yoe
"from an objective viewpoint, his argument was far from rational.",nge ge ray wa lay bay wa chin choe ge khung de den dha lay me thri bay
it is not optional.,ani dhi optional men
do you mind my making a suggestion?,chie ghi chamchar chi lab na may
pema did not say that.,pema gi di zum di malab
we have got to be ready in thirty minutes.,nga chay tsu karma sum chu na dra dre jo go
he shook hands with the mayor.,kho mayor da chikha handshake baynu
i hate terrorist organizations.,nga terrorist mi tshu di miga way
we won.,we won
i will do it right now.,nga bay wong dha ta rang
did you hear the news?,new thong yi bu?
we are not gonna make it.,ngacahy bay metsu ni mae
my book has to be somewhere in the room.,ngyi ghi book dhi na lay pha tshu ra wong go
he grows vegetables in his garden.,kho gi garden na tshetse tshu ni yoe
i do not know what could've happened.,gachi bay yong ga nga meshey
i excused myself for a minute.,minute chi ghi den lu excuse go bay
tell thinley i still have his umbrella.,thinley ge unbrella nga lu yoe say lab na
what are some foods you usually eat with a spoon?,"choe gi spoon use bey bey, toh gachi ra za wong?"
