english,romanized
did pema go alone?,pema khora joye ya
i really like this skirt. can i try it on?,nga ani skirt di nami samey gawey. nga atsi gen ta ga?
get out!,thoen song!
"a cup of tea, please.",ja phrob chi nang wai
it is out of fashion.,ani dhi dhang phu ghi chi embay
the mother of that child is an announcer.,ani alu ghe aie dhe lo lab me dhe embay tay
the men followed him.,ab dhi ghi ting da day
you are gross!,choe khamlosisi du
i am listening.,nga ngyen do
the train lurched to a standstill.,tain dhi stop na wong yee
i taught myself french.,nga ra french lhab chi
his leg was bitten by a crocodile.,kho ge kam chusen ge so tab
you can wait for me here.,nga gi dhen lu na gu dhey marey
she was not friendly with him then.,mo nga yam zhen zum drel wa me
he stared at me from head to foot.,kho gi nga lu guto lae kam tsen tadey
we stopped for lunch at a local restaurant.,nga chay nima ghi zey dhen lu khang za na lu gu yi
that cannot be good for you.,ani choe doen ly laeshom mem wong sa
is the cat on the chair or under the chair?,jili chair in thokha mo holu mo ?
that is all i do.,anim chi ra en nge laa
i will never let that happen again.,nga dhaben log ane zum me bay
are you losing your mind?,choe chhay sob drey mena
adjust the brakes.,brake adjust bay mae
these questions can be answered quite simply.,ani question tsu ni answer simple na bae tsub tay
i remember hearing about pema.,chay ray tang say nga gi pema gi kor lay ha go yi
her hair was long enough to reach the floor.,mo ge hair de floor na ya hey ne may
it was where tashi said it would be.,pha dhey yi tashi ghi lab mi na
"a man with a watch knows what time it is, a man with two watches is never sure.","phoja watch chi yoe me gi time gamchi ena shey wong, phoja watch ni yoe me gi nam ya sure may wong."
it is 50 yen.,dhi yen embay.
the tv's on.,tv on ra yoe
he has recovered from his bad cold.,kho tshadrim lay dra nu
they have explosives.,khong bae sa explosives du
he shined his shoes.,kho gi lham yoe badhey
she gave me a nice pair of shoes.,mo gi nga lu juta layshom chi jin dhey
what a strange story!,story psyco chi mey
they were dancing to the music.,choe music na dance baydhey
i do not want your legal advice.,nga advice me gi se legal bay ru
please turn in your homework by tomorrow.,choe tsu gi homework di naba submit bay mae
keeping a diary also gives us a chance to reflect on our daily life.,gachi ra bew ena dri zhaba chin rang gachi bew ena shey tshup enn
keep me informed.,nga lu lab dhi ra dhey mae
tashi sang me a song.,tashi gi nga lu song chi sing bay dhay
i have spent most of my life here in boston.,nga mam ra boston na doe yi tay
almost everything has been improved.,halam chi gara yargay jonu
i am really angry right now.,nga dato tsip za bay yoe
my homeroom teacher is mrs. jackson.,nge gi lobkhang lobpoen dhi mrs jackson een
i am at the restaurant.,nga zakhang na yoe
i want to see what is on the other side.,so so side na gachi yoe ga ta go bay
this has all been a misunderstanding.,dhi gayra goda chiju may
a soldier often has to confront danger.,soldier tsu threl threl danger confront bay go
i am shy.,nga ngo tsaw mae
who will take care of your cat then?,choe gi jili gagi dazin bayni tey
you are in the right place.,choe hoe go mi sa go na em bay ty
my mother was sick for two days.,ngyi mother nim ni gi dhen lu na bey dheyi
he bought a dozen eggs.,gongdho dozen chi nyo nu
i go jogging.,nga jukni yoe
gyeltshen was forced to resign.,gyeltshen forcedfully gom zhu chunu
what is that bird called?,ani bja dhi gachi lab mo?
do you see a black horse?,choe gi ta nap chi thom mey ga?
i want to go to sweden.,nha sweden jogo noi
what kind of places would you like to see?,gachi zum gi sa go tago noyi
he has many tenants on his land.,kho ghi sa na khanyep laesha dhu
the engine died.,engine shi so nu
the mailman comes around every three days.,mailman dhi atara nyim sum gi shu lay wom een
help us.,charo bay nang nga chey lu
we worked together.,la chi kha bay hay
my parents sent me to fat camp when i was thirteen.,ngyii ap aie gi fat camp na nga lo chusum nang tang yii
i regret what i said.,logoe kay gop jungye lab tsa bay
i would like to explain this in a little more detail.,nga gi atsi more detail na explain bay gay
all our teachers were young and loved teaching.,teacher tshu gara chungku bay pecha toen ni lu ga
i have never tried.,nga nam ya try ma bay
smoking is permitted.,tamkhu thung cho
our financial problems are serious.,teru mibi k ngyel bom yoe may
they hid themselves in the shadows.,khong tshu shadow na lay pha epp doe nuu
i asked him a question.,nga gi kho lu question chi ask bay yi
i think thinley is a really nice kid.,thinley dhi alu layshom dhu sey
half of them are students.,khong chekka chi lobthru embay
no one's prepared.,gaya prepared mindu
i was not responsible.,nge genkhu men
i skipped english class this afternoon.,dari nyima na nga ghi eng kay lhab chi
no one believes that anymore.,gagi ya believe mibay aphi di
go away.,go away
can i tell you guys something?,cheng lu lo chi lab ga?
pema did not want to talk to anyone.,pema ga lu yang lo lab go ma noye way
dorji and mary are playing a video game.,dorji dang mary game tsey dhey nu
he has small feet.,kho luu kam chungkhu yoe.
i do not understand what the author is trying to say.,author gi labmi hamago
i am getting married next sunday.,nga next sunday ngyen chab dho
that box is bigger than this one.,ani box dhi aphi box lay bome yoe
you are free to go.,choe jo do choe
gyeltshen went to japan on a work holiday visa.,gyeltshen japan na ya so nu la gi visa na
this doctor is a man of culture.,kho dhi namsel dhu ga mi mae
it would be better to try.,try bay wa chin dra wong
did anyone notice anything unusual?,ga gi ya gachi chi mathong ga?
the captain is responsible for the safety of passengers.,captain di responsible en passenger safaty doen lu
please tell pema i am sorry.,pema lu nga gi sry lab day say
i need more time.,nga lu dhutshey atsi gho bay
i am not sure what he was thinking.,kho gachi lap ina nga ten ten mi
pema's reaction was the opposite of what mary had expected.,pema gi reaction di mary gi opposite may tay
they begged us to help them.,help bey na zey kuchey sho dhey
can i think about it?,ani gi korlay nga nosam chi tang cho ga?
we are in college.,nga chay college na ne
"i would like to ask you a question, but if this is a bad time, i can come back at another time.","nga choe lu question chi ask bay ni yoe sa but dato bad time en ba chin, next time ask aby gay tay"
that sounds awesome.,ani ben khas dhu se
his debt came to 100 dollars.,kho ghi bangki dollars gu hae chi
my aunt grows tomatoes in her garden.,nge gi ama gi dum ra na lam men dha kay wong
we have still got a lot of time.,daru ya duetse lasha yoe
i planted an apple tree in my garden.,apple gi shing chi tsui nge dumra na
do not ask me to do this.,nga lu bae sae ma lab
she was stupid enough to go out with him.,mo dhi stipud chi doe nu kho chikha date bay bay
i think we are going to win.,nga chay gay ni zum chi yoe nga gi baewa chin
he kindly answered questions.,kho gi len layshom bay lab dhay
he acknowledged my presence with a nod.,kho guto yu dhay
lock your door.,gho dung n
that is the one thing i am sure of.,ani cham chi en zum bayi
would not you rather sit by the window?,choe gochu ghi dong kha mi dhey ya?
i fell in the pool.,nga pool na bue ya c
i dated mary for three years.,nga mary chikha lo sum date bayi
i worry too much.,nga tsha gay lam bay
why are you wearing that?,choe ani gachi bay gen mo
"because her parents got divorced, the girl had little contact with her father.","mo gi apa dang aei kha jay ni di gi, mo apa dang chi kha drelwa namey samey chi thab ni mi"
you will never know whether you can do it or not if you do not try.,"cho gi ma baw tshen, bay tshub , mi tshub mi shay"
i do not have the time for this.,de tshay me ani ghe dhen lu
food costs money.,za ni gi den lu teru go sii
he had his share of luck.,kho ra gi kaww thob nu
it was a waste of time.,due tshey zoni la mae
i am taking tomorrow off.,nga naba nayl so len dho
carry her to the operating room.,mo operation room na ba
he follows the rules to the letter.,kho gi rules follow bay wong to the letter
everyone in my family is happy.,nga choe puencha gara sem ga bay yoe
they love their kids.,khong gi khong ra gi alu lu ga
i am not sure about this.,mashey ba ani dhi
he needs a towel.,kho towel go bay lo
"on behalf of my classmates, let me say a few words of thanks to you.","classmates ghi khatho lay, few words chi jga ghi share baygayy"
i borrowed the book from this library.,nga book ani library lay borrow bei
that is ridiculous!,psycho gi lo mey
am i first?,nga first enna?
what else did you eat?,gachi za ni
the water was cut off yesterday.,khatsa chhu chay c dhu
"the girl was carrying several books, not textbooks but thick hardback books.","bum dhi gi didhep laysha baday, lopdep menba dhidep satra ra may"
can you tell the difference?,difference lab tsub ga choe gi
go now.,jo datara
i need to sleep a little.,nga atsi nye go bay
help me for just a minute.,dueyuen karma chi ge denlu charo bay na
we used to sit on these steps and talk.,nga chey rani step na dhey nay lo lab wong
it is not a virus.,dhi virus men
tell me more.,nga lu mam labsh
something must be wrong with the camera.,camera gachi nachi bay nu
i did not suspect anything.,ga chi ya suspect ma bay tay nga gi
chime overslept.,chimi nyel da nu
he wanted to see his boss in tokyo before leaving for america.,kho america majo wae heyma kho rai gopen tokyo na chay ni mae.
he works for a big newspaper with a very large circulation.,"kho neysul khang bom chi na la baw en, kho ngo shep ya leysha yoe"
gyeltshen is calling us a taxi.,gyeltsehn gi taxi call chab dey nga chey doen lu
i chose last time. you choose this time.,nga gi last time choose bayi. this time choe choose bay mae
the teacher asked me a difficult question.,lebey ghi nga lu driwa lhakha chi jin yi
nobody is perfect.,mi ga ya perfect mi
hug me.,pham tan na nga
"in a democracy, it is important that the press be independent.",democracy na press di independent doe ni gi important en
she was close to breaking into tears.,mo ngu ni zum du
he is a liar.,kho shobzay inn
his curiosity knew no bounds.,kho gachi ya shay go
he could die.,he sisi wong
it is not a date.,ani de date man
join us.,join bay ngachey
she pretended not to hear him yesterday.,mo gi kho gi labmi dhi hara magaw zoom doeb may
call us.,call bay nga chey lu
i am glad i did it.,nga ani bey bey tiktik tang nu
chime is voting.,chimi tshogyen tshu day
no one's here.,gaya mindhu
what a beautiful town!,throm di laybay
i left.,nga ya cc
she almost always arrives late.,mo atara late bae wom mae
i do not understand what all of the fuss is about.,nga ha mi go way gachi na dop enna
hold on.,doe atsi
i thought it over and decided not to go.,nga gi di zoii c noi delya mejo c noii
gyeltshen does not understand you.,gyeltshen gi choe hame go way lo
that movie was amusing.,aphi movie bein jigs doeyi mey
was that another joke?,dhi gaydro so so en ya?
thinley sings in a church choir.,thinley church choir na sing bay dhay.
i think dorji said he'd be back.,dorji gi kho lok wong say lab they
gyeltshen speaks french fluently.,gyeltshen ghi french layshom lap mey
i have hardly any money with me.,nga lu teru atshi yang mi
i know the perfect place for our party.,nga ge perfect place chi shay party ge denley
i love that place.,nga aphi sago di gha
there is no chair in this room.,ani room na chair mindu
we will be together forever.,nga chey chikha ra dhae yong mitshey chi
i am not satisfied.,nga satisfaction ma thop
you should look up this word.,yani word di lhab ba chin lekshom en
he bought her a sweater.,kho gi mo gi sweater ngo nu
"introducing foreign plants, such as palm trees can damage ecosystems.",chigyel ghi tshing dhung tshu na tshu ni zum talai shing tshu rang zing nye tang lu nyeken jung hong
introverts often find it difficult to make new friends.,introver tshu charo sab zo ne lakha tang ne yoe
what if someone sees us?,ga chi bay ne ri ge nga chay thong ba chin
this milk has a peculiar smell.,ani om ben ham ta nu
"i will take your suitcase to your room, sir.","labay, nga gi choe gi dom ba gin gay"
he lives in a big house.,kho chim bom na deyhong
he did not attend the meeting.,kho meeting attend mabey
come on!,sho cc!
i did this for my son.,nga rai bu gi den lu baye
hang on!,atsi gu
no wonder he was arrested.,gachi arrest mijo ni tay
ugyen hates homework.,ugyen homework megai
it was kind of you to help me.,choe laeshom bae nu nga lu cahro bae di
an extremely terrible thing happened to him.,kho lu namay samay drosisi neytang chi jungnu
the foreign minister attended the talks.,foreign minister jhoen dhey
air is to man what water is to fish.,luma megi denlu chu nya gi denlu
tashi has been teaching me how to play the guitar.,tashi gi nga lu dramnyen tro ni toen jin dey jini yoe
how can i get to the station?,nga gadey bay bus zha sar jo gob mo?
he was worn out when he got home.,kho chimna haypda wu dura dunu
"if you teach me how to dance, i will show you my hidden scars.","choe gi ngalu zhabtra chab ni ten bachin, nga gi chodup ten jenhong choelu nge"
our fate is in your hands.,nga chi lo tay sa ra choe gi lap kha en
his shoes are brown.,kho gi shoes color dhi brown may
we will be back after the break.,nga break ghi jaab ley thoenwong
he must have stacked them up against the wall.,kho gi dhitsu tsig pung zha zhab wong jang gu
what do you consider your greatest achievement?,choe gi dato tshen gi la bom ra gachi beyi
japan is at peace with her neighbors.,japn di peace bae doenu mena kho ra gi neighbours ngyam
someone's talking.,ga emu chi lo lab dae
it'll come in handy.,kha chey dho wong
it is not known who first invented the wheel.,mashey ty wheel zo mi ga enna
i do not particularly want to do that.,nga ani bay go mano
i cannot make it any clearer.,"dem chi lay, ga dem chi clear lab gob mo"
it is not good enough.,ani gi the mi thub
i delivered a lecture in english.,nga ghi ingkay na paycha tenyi
may i have the key?,dhimi nang mey
"no, i am not mad at you, i am just disappointed.",choe ta bay nga tsib maza. choe ta bay nga lo pham c
i have never worn a tuxedo.,nga tuxedo namya magyen
she went to italy to study music.,mo italy to music lhabjang bay wa songyi
ugyen is capable of anything.,ugyen gacxhi ya bay tshu bay
what time will you be back?,time nam lok wong chie
i watch tv now and then.,nga dato dato ba nara tv ta wong tay
i have never seen my cat act like that.,nga gi jili ani zum baysa hayma mathong
we have all done things we are ashamed of.,nga chay gha ra ghi ngo tshay bi lay bay ye
the food in my country is not very different from that of spain.,na gi zhay go tsu spain da dra nyam dhu
"warm this morning, is not it?",dopa warm du mo
"if you were more ambitious, you could go a long way.",choe ambitious em baa chin choe gi chi bay zaa wong
the rain shows no sign of stopping.,cham chay ne loju ra mindhu
is this good french?,ani french layzum ena
plants require co2 to grow.,plants tshu dhi bom joni dhenlu co go batt
i just want to be perfect.,nga perfect baygo noyi
keep the door open.,goh chee bay zha
i do not know how to reach you.,choe luu ga they bay lab na mashay
the wind is cold today.,dari luma khoesisi bay phu dhey
"just one moment, please.",atsi gu
was anyone in the room?,room na gaya madhoe bu?
he is still sick in bed.,kho dato ya na bay may cha na ra du
hollywood marriages rarely last.,hollywood gi nen ben am chi last me bay
i already know.,nga gi shay
the floor must be kept clean.,khang dey hing sasa bay zha go
i just do not want to be left alone.,nga nga ra che shu ma loe gho ma no
i just decided i would come home early.,nga decide bay yi nga chim na early jogo sey
chime drank a glass of water.,chimi ghi chu glass chi thung nu
i persuaded him to give up the idea.,nga gi kho nekab ko zha da sey
all the people who were here have left.,na doe ni mi tshu gara joyi
i will try to distract them.,nga khong distract bay gay mai.
your composition is the best yet.,choe gi zo mi dhi jigss dhu
you need to leave here at once.,choe dato ra jogo bay
i am very hungry.,nga namisami tto kay chi
he put great emphasis on spoken english.,kho gee english mam tshenshu kaw mai
i am on your side.,nga choe ge side na en
i have got to do something first.,i dangpara la chi bay gop yoe
your suggestion seems reasonable.,choe ghi samchar dhi jung khu yep chi dhi
i slept in front of the tv.,nga tv dong kha ngy dha nu
"i will do it, if you insist.",choe nen ma tup ba chin nga bay gay
"since i had a cold, i did not go visit him.",nga tsadrim thob ni digi nga kho bay sa jo matsub
hang on!,gu na may atsi!
i do not know much more than that.,dhi ley maam mishay
i am sort of tired.,i asti wudu yi
how dare you enter my house without permission!,choe nge chim na nangwa me ba ga gi zue lo
i cannot stay for dinner.,nga dinner na doe mitsub
can you identify the man using this picture?,choe gi me dhi ani paar tabay tshachi ngoezin bay tshub ga?
what a pity!,gamchi phang si si dhu
she put down her thoughts on paper.,mo gi noksam tang mi di dri nu tay
whales feed on small fish.,whales tshu nya chunku tshu za we
i got to the bus stop just after the bus had left.,nga bus stop na hayp chi bus gi ko zha ya si
i am very tired.,nga namay samay wu dhuyi
i thought it was lunchtime.,nimai togi duetshay emay noyi
chime needs help now.,chime charo gobae
she speaks chinese.,mo jamae kha chab mae
go slow.,droe gay jo
there is not a big difference.,khay par bom mindu
she waved her hand to us.,mo gi lab yue bay bae they
he is familiar with japanese culture.,kho japenese gi culture dang familiar yoe
would you be interested in having dinner with me?,nga chikha cheru ghi toh chi zawa jon na
i suppose you want to ask me where i have been.,choe gi nga gaty yoe ga dre go noyi ya
what a pleasure!,gamchi pleasure dhu
my mother made me study.,nga aii gi pecha ta chu yi
i bet stuff like this does not happen to thinley.,kho na dhizum thoen rang me thoen
chime does not like to talk about that.,chime gi ani korlay lo lab goo mee noe way lo
i have not been able to go to school for a week.,nga school na majo ba one week joyi
gyeltshen remembered that mary and john had tried to kill him.,mary dang john gi gyeltshen tsay ni bayi say dato cheri dhu
did not your parents give you anything?,pham gi gach ya majin bu
he apologized to her for being late.,kho late jow da mo lu sorry lab dea
chime said he did not want to eat anything.,chimi ghi kho gani ya za go mano labdey
we cannot reveal classified information.,ani nay tshul dhi lab me tshub
take a shower.,zu chu
they had several children.,kho tshu lu alu laysha du
i see how you did that.,nga ghi shey choe ghi gadey bey baye
"as is often the case with him, he came late.",ani mi dhi nam bay ru chhisu chira een
it is nothing short of a miracle.,yamtsen choe toh toh dhu.
i caught him by the arm before he could fall.,kho bab ri ni bew dha nga gi kho lap zung zha yi
she sang as she walked.,mo lam joyi ra zhadra thoyi
i would like to talk to the doctor alone for a moment.,nga yep tho chi dungtsho kho rang cham chi bey lo lab go bey
they exchanged greetings.,khong laymeen jay soor bayi
please tell me how to get to the airport.,airport gi lab gaty lae enna lab nang mae please
everyone laughed at this mistake.,mi gara khong ge zelwa ge bay gaa doe nu
i am not ready to fight.,nga thab ni ready me
i do not want to hear any more excuses.,excuse na may sa may ma zo
we have to make the most of this situation.,duesthey layshom bey use beygo
i feel good after a workout.,workout tsabay nga deytotok baw may
does it snow much in the winter?,nam guen khaw chab mae bu
be ruthless.,ruthless bay oi
my eyes feel gritty.,nge me tho ma dea kha kha baw mae
i can speak english.,nga gi enkay lab shey
this guy is great.,kho jigs dhu
a man appeared at the door.,bhus chi go gi thama dhu
you are with friends.,nga charo nam yoe
i finished it.,nga zo c
i was at a job interview.,nga yog gi diwa drilen na deyi
he is eager to go there.,he jo go no nu
do not you think tashi and john look alike?,tashi dang jhon same ming dhu
the feeling's mutual.,feelings mutual
education is an investment in the future.,sherig dhi mawongpai matsa tsu mi chi en
i cannot do it right away.,nga ghi dhato rang bay metshu
are you coming to the store with me?,choe nga nyam store na wongni ya
criminals should be punished.,ngen lay ghi la bayme dhi yang cha tani me wong
i do not talk to him anymore.,nga kho nam kha lab ni mi
your son is a genius.,choe bu de layshom du
you are the tallest of us all.,choe nga chey gara ley zu rim dhu
why are you so scared to talk to him?,kho nam lo lap ne drobbay ya
i learned a lot this weekend.,halam lhab chi weekend na
he is kind of handsome.,kho sarim dhu
go now.,dato ra jo
they were better than i expected.,kho tshu dhi layshom dhu nga nome cheb dha dhi
i like playing golf.,nga golf tse ne ga
let us clean up this mess.,cho kha chab gay dabayn
the tubes are clogged.,tubes gara sup dha nu
there is always hope.,raywa dhi yoe ra yoe
so much is happening.,halam che na bew may sa
who do you work for?,choe gagi then lu la bayw mo?
"you will get there in time, so long as you do not miss the train.","choe time nara haewong, train ra miss mabay wa chin"
i have to study for the exam.,nga exam gi doen lu paecha tago
i must obey.,nga ghi nyen gob en
i wish him the very best in his future endeavors.,nga kho ra future gi den lu best ra nodo
you should check your blood pressure.,choe blood pressure check baego bae
you are deceiving yourself.,choe go choe lu shob ma chap
how did you come by this painting?,oi choe ghi tshen hani gha dhey bay dhom chi
you are drunk!,choe drunk ya cc nu
you look tired.,choe wu dung nu mae na
is that why you want to kill me?,choe nga sey go no mi di ani kor lae ena?
i am not as busy as tashi.,tashi nga zum chi ra dayw me
her mother always accompanies her.,mo ama ghi atara mo lu jab chor bew
take out the trash.,ani chha nyi dhi ten dha
he insisted that i join him.,kho gi nga sho sae nen mathub
do not walk out on me again.,walk out mabay may daru.
he spoke well of her son.,mo gi morayi bu gi loju leyshom lab mey
it was time for lunch.,nyima ghi saew ren chi
we have not had to deal with this before.,anzum heyma mabay
this mountain is covered with snow all year round.,ani la di lo tabu ra khawo gi pub faywong
the people rebelled against the king.,mi tshu ghi king lu ngo lodhey.
i finally caught up with my friends.,charo tsu da chay chi
i have explained all of this to you before.,ani tshu gara choe lu hema ley ra lab chi
could you please not smoke in this room?,choe gi room na tam khu ma thung ba chin nga sem gani may
she came out on top.,mo top na thoyi mae
give me your flashlight.,che gi flashlight na
give up smoking if you want to live long.,choe tsay rim bae dey go nowa chin smoke bani zhada
i was able to answer all the questions.,nga ge driwa ge len tshu gayra len chab tshub che
do you want something cold to drink?,khesisi chi thu ni na
i love bananas.,nga ngala gaa
you cannot buy it anywhere but there.,zhoen gaty ley ya nyo matshu ana ley ra nyo go
this dictionary is expensive.,ane tsik zay dhe gong mam may
i just need a hug.,nga hug go bay
he fell asleep immediately.,kho joba ngy thay so nu
i have actually heard of this.,nga gi ani di hoe ma lay ha ho yee
was it all a dream?,ani gara ngyelam ena?
what is that disgusting smell?,ani drim kham lo cc dhi gachi ena?
i hate silent movies.,nga silent movie mi ga wae
nobody will help you.,gagi ya charo mibey choelu
i really do not want to do this.,nga baygo magno
i am a deeply religious man and believe in life after death.,"nga choesem chi yoe, tshey shuma zermi dhi ha go"
can i go swimming this afternoon?,nga dha re afternoon na swimming na jo ga
what is your favorite sport?,choe gi gasho tshe rig dee gachi mo
how long have you known her?,choe nam lay moo ngoe shay chi?
how did you hurt your back?,choe gi gayto dhi ga dhay bay dhungyi
employers sometimes exploit their workers.,la yo jin mi tshu gi thre thre khong rai la baymi tshu lu log chay bew en
this house is very comfortable to live in.,ani chimn dhi deytok tok dhu.
do you have a school uniform?,school uniform yoe ga choe lu?
i need to charge my cell phone.,nga phone charge bay goo bay c.
it made me laugh.,aney gi nga ga chu yee
does not it sometimes just get to you?,ha migo way bu
water is important.,chu kha chay
the factory uses many complicated machines.,zokchim gi thrieche madraw lasha laglen thab may
we are going to invite tashi and mary to our halloween party.,khong nye yang bo nee
i see what you mean.,choe ghi lhab ni tsi chab mi hagoyi
he runs.,kho ju wong
nobody forced you to help me.,gagi ya choe lu force mabay help bay ni doen lu
we are contented.,nga lang yi
"there are a few apples on the tree, are not there?",shing gu apple atsi meen dhu ya?
"from here on out, it is smooth sailing.",ana lu dhi lam gatto tto dhu
please throw the ball.,ball ko wai please
dorji is obviously busy.,dorji lu duetshey mindhu
does the hat fit well?,zham layshom bay tubay ga
pema has three brothers.,pema lu nuchu sum yoe
could you send this letter to japan?,yiggu dhi japan lu kay na may
what have i done?,ya... nga ghi gachi bayi ga
the light is out.,mi ma tay bey
i will go.,nga joni
do not talk about work. we are on vacation.,"la gi korlae malab, nga chey vacation na en"
mt. fuji is higher than any other mountain in japan.,gangri fuji dhi ga ni wa bom gangri chi mae japan na
the ship had three decks.,ship lu deck tsum du
monopolies are bad.,monopolies dhitsu layzhum men
he will be sure to smell a rat if i am with you.,nga choe da chikha yoen kho gi drim tshowong
i wanted to see thinley.,nga thinley go bay
i had that weird dream again last night.,daro nga khatsha chiru nyelam dro sii si thong yii
i am not in love with you.,nga choe lu mi ga
she was making tea.,mo dachi ja zo dey
please answer all the questions.,len gay ra jin la
